{
  "$schema": "https://json-schema.org/draft/2020-12/schema",
  "$id": "https://immu4989.github.io/awesome-agentic-usecases/schemas/public-value-pilot-0.1.json",
  "title": "AAU Public-Value Pilot 0.1",
  "type": "object",
  "additionalProperties": false,
  "required": ["pilot_version", "pilot_id", "title", "beneficiaries", "accountable_owner", "task_contract", "pre_registration", "human_protection", "field_observation", "reproduction", "sources", "limitations", "claims"],
  "properties": {
    "pilot_version": {"const": "aau-public-value-pilot/0.1"},
    "pilot_id": {"type": "string", "minLength": 1},
    "title": {"type": "string", "minLength": 1},
    "beneficiaries": {"type": "array", "minItems": 1, "items": {"type": "string"}},
    "accountable_owner": {"type": "string", "pattern": "^human:"},
    "task_contract": {"type": "object"},
    "pre_registration": {"type": "object"},
    "human_protection": {"type": "object"},
    "field_observation": {"type": "object"},
    "reproduction": {"type": "object"},
    "sources": {"type": "array", "minItems": 1, "items": {"type": "object"}},
    "limitations": {"type": "array", "minItems": 1, "items": {"type": "string"}},
    "claims": {"type": "object"}
  }
}
