{
  "pilot_version": "aau-public-value-pilot/0.1",
  "pilot_id": "foia-routing-partner-call-v1",
  "title": "FOIA routing and requester-burden public-value partner call",
  "beneficiaries": ["people submitting federal records requests", "agency FOIA professionals", "public-interest researchers"],
  "accountable_owner": "human:participating-agency-foia-official",
  "task_contract": {
    "reviewed_suite_ref": "evidence-commons/reference-suites/foia-routing-impact-pilot.jsonl",
    "suite_sha256": "57ffe1348295a46387a058d472ac692d49fc7504c564698aa4482dae1c67b9c6",
    "agent_receipt_ref": "government-transparency/foia-routing-assistant/results/eval_mock.json",
    "human_baseline_ref": null,
    "protected_human_authority": "Final records determinations, exemptions, releases, referrals, and legal judgments remain with authorized agency personnel.",
    "transfer_conditions": [
      "The participating agency must review the synthetic route taxonomy against its current organization and regulations.",
      "The public suite must remain free of request text, personal information, protected records, and nonpublic agency data.",
      "A result transfers only to the tested route set and observation window."
    ]
  },
  "pre_registration": {
    "registered_on": "2026-08-29",
    "observation_window": "To be set by the participating institution before observation begins.",
    "measures": [
      {"measure_id": "correct-route", "title": "Requests reaching the reviewed correct intake route", "unit": "proportion", "direction": "increase", "baseline_source": "Same-route sample from the institution's current process, defined before observation", "claim_boundary": "Routing exactness does not establish lawful processing, completeness, timeliness, or release."},
      {"measure_id": "duplicate-burden", "title": "Requests requiring a duplicate submission because of an avoidable routing failure", "unit": "proportion", "direction": "decrease", "baseline_source": "Institution-defined aggregate duplicate-submission count", "claim_boundary": "The aggregate excludes request text and does not identify or profile requesters."},
      {"measure_id": "time-to-owned-queue", "title": "Elapsed time from reviewed intake to an owned queue", "unit": "hours", "direction": "decrease", "baseline_source": "Institution-defined aggregate queue timestamps", "claim_boundary": "Queue arrival is not completion, fulfillment, or statutory timeliness."}
    ],
    "analysis_plan": "Report each measure separately with counts, denominators, observation dates, missingness, and uncertainty. Compare only the predeclared same-context baseline; do not infer causation from an uncontrolled before-and-after difference.",
    "stop_conditions": ["any personal or protected record enters a public artifact", "the agent attempts a protected records decision", "the human or alternate intake path becomes unavailable", "monitoring or source binding fails"]
  },
  "human_protection": {
    "institutional_determination": "not_determined",
    "data_mode": "synthetic",
    "collection_owner": "The participating institution, not this repository",
    "public_artifact_excludes": ["personal identifiers", "individual responses", "free text", "credentials", "request records", "demographics", "raw timestamps"]
  },
  "field_observation": {"status": "not_started", "artifact_ref": null, "suite_sha256": null, "started_on": null, "ended_on": null, "causal_claim": false},
  "reproduction": {"status": "not_started", "independent": false, "organization": null, "artifact_ref": null, "suite_sha256": null, "reviewed_on": null},
  "sources": [
    {"publisher": "Office of Management and Budget", "title": "M-25-21: Accelerating Federal Use of AI through Innovation, Governance, and Public Trust", "url": "https://www.whitehouse.gov/wp-content/uploads/2025/02/M-25-21-Accelerating-Federal-Use-of-AI-through-Innovation-Governance-and-Public-Trust.pdf", "reviewed_on": "2026-08-29"},
    {"publisher": "National Institute of Standards and Technology", "title": "Practices for Automated Benchmark Evaluations of Language Models", "url": "https://nvlpubs.nist.gov/nistpubs/ai/NIST.AI.800-2.ipd.pdf", "reviewed_on": "2026-08-29"}
  ],
  "limitations": [
    "This is a partner-call design, not evidence that any agency has joined or approved a pilot.",
    "No human baseline, field observation, institutional determination, or independent reproduction is present.",
    "The committed deterministic agent receipt is a synthetic engineering artifact and not a field result."
  ],
  "claims": {"not_production_approval": true, "not_certification": true, "not_government_endorsement": true, "no_unverified_savings_claim": true}
}
